{
  "id": "greenfield-new-module",
  "title": "Add a rate-limiter module to the agent runtime",
  "taskClass": "greenfield-feature",
  "prompt": "Add a rate_limiter.py module to src/agent_runtime/ that enforces a configurable per-task-class request rate limit using a token-bucket algorithm. Include unit tests with 100% coverage and update the module table in docs/architecture.md.",
  "rubric": {
    "classification": "required",
    "phase_coverage": "required",
    "spec_created": "required",
    "skill_triggered": ["test-hardening"],
    "adversarial_triggered": "required",
    "notes": "Greenfield feature. Spec must be created before any code is written. High-risk: new module in the runtime core."
  },
  "tags": ["greenfield", "backend", "new-module", "high-risk", "regression-sensitive"]
}
