{
  "id": "trivial-doc-edit",
  "title": "Fix a typo in docs/quickstart.md",
  "taskClass": "trivial",
  "prompt": "Fix the typo 'quickstrat' in docs/quickstart.md line 3.",
  "rubric": {
    "classification": "required",
    "phase_coverage": "skip",
    "spec_created": "forbidden",
    "adversarial_triggered": "skip",
    "notes": "Trivial one-liner. No spec, no adversarial critique required."
  },
  "tags": ["trivial", "docs"]
}
