{
  "id": "review-only-diff",
  "title": "Review a diff adding a new API endpoint",
  "taskClass": "review-only",
  "prompt": "Review this diff:\n\n```diff\n--- a/src/agent_runtime/routes.py\n+++ b/src/agent_runtime/routes.py\n@@ -50,0 +51,6 @@\n+@router.delete('/api/tasks/{task_id}')\n+async def delete_task(task_id: str, store: RuntimeStore = Depends(get_store)):\n+    if task_id not in store.tasks:\n+        raise HTTPException(status_code=404)\n+    del store.tasks[task_id]\n+    return {}\n```\n\nIdentify any correctness, security, or API design concerns. Do not modify any files.",
  "rubric": {
    "classification": "required",
    "phase_coverage": "advisory",
    "spec_created": "forbidden",
    "adversarial_triggered": "skip",
    "notes": "Review-only. The orchestrator must present findings without writing code."
  },
  "tags": ["review", "backend", "api"]
}
