{
  "id": "memory-store-search",
  "title": "Query memory store for similar past failures before planning",
  "taskClass": "research-only",
  "prompt": "Before implementing a database migration, search the agent memory store for any past failures related to alembic, migration, or database schema changes. Summarise the top 3 most relevant postmortems and their prevention patterns.",
  "rubric": {
    "classification": "required",
    "phase_coverage": "advisory",
    "spec_created": "skip",
    "skill_triggered": [],
    "adversarial_triggered": "skip",
    "notes": "Pure research task against memory store. Classification as research-only is required. No spec creation needed."
  },
  "tags": ["research", "memory", "database", "brownfield"]
}
