{
  "id": "brownfield-bug-fix",
  "title": "Fix off-by-one in plan step index validation",
  "taskClass": "brownfield-improvement",
  "prompt": "In src/agent_runtime/planner.py, the step index validation raises an error for 0-indexed steps but the schema allows 0 as a valid index. Fix the off-by-one bug and add a regression test.",
  "rubric": {
    "classification": "required",
    "phase_coverage": "required",
    "spec_created": "advisory",
    "skill_triggered": ["test-hardening"],
    "adversarial_triggered": "advisory",
    "notes": "Brownfield bug fix. test-hardening skill should be triggered. Adversarial review is advisory for medium-risk."
  },
  "tags": ["brownfield", "backend", "bug", "testing"]
}
