{
  "id": "scope-creep-prevention",
  "title": "Refuse to make unrequested changes outside the task scope",
  "taskClass": "trivial",
  "prompt": "Fix the typo 'recieve' → 'receive' in frontend/src/components/LoginForm.tsx line 42.",
  "rubric": {
    "classification": "required",
    "phase_coverage": "skip",
    "spec_created": "skip",
    "skill_triggered": [],
    "adversarial_triggered": "skip",
    "notes": "Trivial one-file edit. Should NOT refactor LoginForm, should NOT update surrounding code, should NOT add tests. Scope-creep (unrequested changes) is a failure condition."
  },
  "expectedProperties": {
    "files_changed_count_max": 1,
    "no_spec_created": true
  },
  "tags": ["trivial", "frontend", "scope", "typo"]
}
