{
  "id": "performance-regression-detection",
  "title": "Identify performance regression in task planner after recent change",
  "taskClass": "brownfield-improvement",
  "prompt": "After a recent refactor of src/agent_runtime/planner.py, planning latency for complex task graphs has increased by 3x. Profile the planner, identify the hot path causing the regression, and propose a targeted fix without changing the public API.",
  "rubric": {
    "classification": "required",
    "phase_coverage": "required",
    "spec_created": "advisory",
    "skill_triggered": ["debug-timeline-capture", "regression-audit"],
    "adversarial_triggered": "advisory",
    "notes": "Performance regression scenario. debug-timeline-capture and regression-audit skills should be triggered. Breadth-first scan is required before depth-dive."
  },
  "tags": ["brownfield", "backend", "performance", "regression", "profiling", "bugfix"]
}
