{
  "id": "test-only-coverage",
  "title": "Add missing branch coverage to validator.py",
  "taskClass": "test-only",
  "prompt": "Add tests for the edge cases in src/agent_runtime/validator.py that are not currently covered: empty findings list, confidence exactly at the threshold boundary, and findings with null details field. Do not change any production code.",
  "rubric": {
    "classification": "required",
    "phase_coverage": "advisory",
    "spec_created": "skip",
    "skill_triggered": ["test-hardening"],
    "adversarial_triggered": "skip",
    "notes": "Test-only. No production code changes. test-hardening skill expected."
  },
  "tags": ["test-only", "backend", "coverage", "regression-sensitive"]
}
