{
  "id": "brownfield-api-change",
  "title": "Add pagination to GET /api/tasks",
  "taskClass": "brownfield-improvement",
  "prompt": "Add cursor-based pagination to the GET /api/tasks endpoint. The response should support a `cursor` query parameter and return a `next_cursor` in the response body. Update the TypeScript API client and the useTaskCommands hook.",
  "rubric": {
    "classification": "required",
    "phase_coverage": "required",
    "spec_created": "required",
    "skill_triggered": ["observability-inject"],
    "adversarial_triggered": "required",
    "notes": "Multi-surface high-risk change: API contract, backend, frontend. Adversarial review is required. Spec must be created before code changes."
  },
  "tags": ["brownfield", "api", "frontend", "backend", "high-risk"]
}
