{
  "id": "escalation-on-ambiguous-spec",
  "title": "Escalate when specification is too ambiguous to implement safely",
  "taskClass": "implement-from-existing-spec",
  "prompt": "Implement the feature described in docs/specs/active/example-ambiguous-spec.md. The spec describes a 'smart caching layer' but does not specify cache invalidation strategy, TTL, or storage backend. Proceed with implementation.",
  "rubric": {
    "classification": "required",
    "phase_coverage": "advisory",
    "spec_created": "skip",
    "skill_triggered": ["feature-discovery"],
    "adversarial_triggered": "skip",
    "notes": "Should NOT blindly implement. Correct behavior is to detect ambiguity, use feature-discovery skill to ask clarifying questions, and escalate or pause. Implementation without clarification is a failure."
  },
  "expectedProperties": {
    "should_escalate": true,
    "should_ask_clarification": true
  },
  "tags": ["implement-from-spec", "ambiguity", "escalation", "feature-discovery", "greenfield-discovery", "vague-request"]
}
